{
  "person_id": "KR-PERSON-000964",
  "wikidata_qid": null,
  "name_zh": "李勋",
  "name": "이훈",
  "name_en": "Hoon Lee",
  "aliases": [
    "Lee Hoon",
    "이훈",
    "Hoon Lee, CFA"
  ],
  "nationality": "KR",
  "gender": "male",
  "birth_date": "1969-01-01",
  "birth_place": null,
  "contacts": [],
  "current_positions": [
    "韩国投资公司（KIC）首席投资官（CIO）/ 投资运营部门负责人"
  ],
  "education": [
    {
      "start_date": null,
      "end_date": null,
      "institution": "西江大学（Sogang University）",
      "degree": "bachelor",
      "field": "经济学"
    },
    {
      "start_date": null,
      "end_date": null,
      "institution": "加州大学伯克利分校（University of California, Berkeley）",
      "degree": "master",
      "field": "工商管理（MBA）"
    }
  ],
  "work_experience": [
    {
      "start_date": null,
      "end_date": null,
      "organization": "三星证券（Samsung Securities）",
      "org_id": null,
      "position": "股票分析师"
    },
    {
      "start_date": null,
      "end_date": null,
      "organization": "NH投资证券（NH Investment & Securities）",
      "org_id": null,
      "position": "股票分析师"
    },
    {
      "start_date": null,
      "end_date": null,
      "organization": "LG投资证券（LG Investment & Securities）",
      "org_id": null,
      "position": "股票分析师"
    },
    {
      "start_date": null,
      "end_date": null,
      "organization": "友利投资证券（Woori Investment & Securities）",
      "org_id": null,
      "position": "企业分析团队分析师"
    },
    {
      "start_date": null,
      "end_date": null,
      "organization": "韩国投资证券（Korea Investment & Securities）",
      "org_id": null,
      "position": "股票分析师 / 小盘股团队负责人"
    },
    {
      "start_date": null,
      "end_date": null,
      "organization": "麦格理-IMM资产管理公司（Macquarie-IMM Asset Management）",
      "org_id": null,
      "position": "投资组合经理"
    },
    {
      "start_date": null,
      "end_date": null,
      "organization": "大宇资本（Daewoo Capital）",
      "org_id": null,
      "position": "投资组合经理"
    },
    {
      "start_date": "2014",
      "end_date": null,
      "organization": "韩国投资公司（Korea Investment Corporation / KIC）",
      "org_id": "KR-SOE-015",
      "position": "研究分析师 / 企业分析室长"
    },
    {
      "start_date": null,
      "end_date": null,
      "organization": "韩国投资公司（Korea Investment Corporation / KIC）",
      "org_id": "KR-SOE-015",
      "position": "战略研究团队长"
    },
    {
      "start_date": null,
      "end_date": null,
      "organization": "韩国投资公司（Korea Investment Corporation / KIC）",
      "org_id": "KR-SOE-015",
      "position": "资产配置团队长兼宏观研究团队负责人（Managing Director）"
    },
    {
      "start_date": null,
      "end_date": null,
      "organization": "韩国投资公司（Korea Investment Corporation / KIC）",
      "org_id": "KR-SOE-015",
      "position": "投资战略集团高级董事总经理（Senior Managing Director, Investment Strategy Group）"
    },
    {
      "start_date": null,
      "end_date": null,
      "organization": "韩国投资公司（Korea Investment Corporation / KIC）",
      "org_id": "KR-SOE-015",
      "position": "投资战略与创新部门负责人（Senior Managing Director, Investment Strategy & Innovation Division）"
    },
    {
      "start_date": null,
      "end_date": "2022-07",
      "organization": "韩国投资公司（Korea Investment Corporation / KIC）",
      "org_id": "KR-SOE-015",
      "position": "未来战略本部长（Head of Future Strategy Division）"
    },
    {
      "start_date": "2022-08-17",
      "end_date": null,
      "organization": "韩国投资公司（Korea Investment Corporation / KIC）",
      "org_id": "KR-SOE-015",
      "position": "首席投资官（Chief Investment Officer / 投资运营部门负责人）"
    }
  ],
  "person_relationships": [
    {
      "person_id": "KR-PERSON-000963",
      "person_name": "朴一荣（Il Young Park）",
      "relationship_type": "superior",
      "description": "朴一荣为KIC会长兼CEO，李勋在其领导下担任首席投资官"
    },
    {
      "person_id": "KR-PERSON-000965",
      "person_name": "朱在贤（Jae-Hyun Joo）",
      "relationship_type": "colleague",
      "description": "同为KIC高管团队成员，朱在贤任首席风险官（CRO）"
    },
    {
      "person_id": "KR-PERSON-000966",
      "person_name": "李尚民（Sangmin Lee）",
      "relationship_type": "colleague",
      "description": "同为KIC高管团队成员，李尚民任首席运营官（COO）"
    }
  ],
  "social_accounts": [],
  "family_members": [],
  "political_stances": [
    {
      "date": "2025-10",
      "topic": "AI投资战略",
      "stance_content": "认为人工智能是塑造未来最具变革性的力量之一，但AI投资的估值快速上升需要谨慎和深思熟虑的方法。通过多元化的方法构建富有韧性的投资组合。",
      "source": "https://www.marketsgroup.org/news/kic-moves-to-tpa-amid-market-volatility-targets-ai-for-growth"
    },
    {
      "date": "2025-10",
      "topic": "总组合投资法（TPA）",
      "stance_content": "主张采用总组合投资法（Total Portfolio Approach）打破内部部门壁垒、优化效率，认为基金规模大小不应影响TPA策略的实施，关键是建立增长型资产和稳定型资产之间的适当平衡。",
      "source": "https://www.marketsgroup.org/news/kic-moves-to-tpa-amid-market-volatility-targets-ai-for-growth"
    }
  ],
  "major_achievements": [
    {
      "date": "2022-08-17",
      "organization": "韩国投资公司（KIC）",
      "achievement": "被任命为KIC首席投资官（CIO），为2012年以来首位内部出身的CIO，任期内管理资产从加入时的847亿美元增长至超过2320亿美元"
    },
    {
      "date": "2026",
      "organization": "韩国投资公司（KIC）",
      "achievement": "主导推动KIC正式采用总组合投资法（Total Portfolio Approach），标志着KIC投资框架和组织模式的重大变革"
    },
    {
      "date": "2025",
      "organization": "韩国投资公司（KIC）",
      "achievement": "KIC 2025年运营收益率达13.91%，总资产管理规模达到创纪录的2320亿美元，成为KIC历史上首次累计投资收益超过委托本金的重要里程碑"
    },
    {
      "date": "2024-09",
      "organization": null,
      "achievement": "受邀出席米尔肯研究院（Milken Institute）亚洲峰会2024并发表演讲"
    },
    {
      "date": "2025-10",
      "organization": null,
      "achievement": "再次受邀出席米尔肯研究院亚洲峰会2025，参与'Navigating the Nexus: Korea AI, Tariffs, and Investment Future'专题讨论"
    },
    {
      "date": "2026-01",
      "organization": "韩国投资公司（KIC）",
      "achievement": "成为KIC历史上首位获得连任机会的首席投资官，原任期2025年8月届满后依据章程继续任职"
    }
  ],
  "biography_summary": "李勋（이훈 / Hoon Lee），1969年生，现任韩国投资公司（KIC）首席投资官（CIO）兼副总裁，持有CFA（特许金融分析师）资格。毕业于西江大学经济学系，后获加州大学伯克利分校MBA学位。早年曾在三星证券、LG投资证券（后并入友利投资证券）、韩国投资证券等券商担任股票分析师，并在麦格理-IMM资产管理公司和大宇资本担任投资组合经理。2014年加入KIC后，历任企业分析室长、战略研究团队长、资产配置团队长、投资战略集团高级董事总经理、投资战略与创新部门负责人、未来战略本部长等职。2022年8月晋升为首席投资官，成为KIC自2012年以来首位内部出身的CIO。在其领导下，KIC于2026年正式引入总组合投资法（TPA），推动投资框架的重大变革，并实现2025年13.91%的运营收益率，管理资产规模突破2320亿美元。2026年初成为KIC历史上首位获得连任机会的CIO。",
  "profile": {
    "source_url": "https://milkeninstitute.org/sites/default/files/styles/large/public/grid/speakers/0031U000026SzfwQAC-394eeee1ebe650a2573dcf861eaa1201.png",
    "local_path": null
  },
  "collection_meta": {
    "collection_date": "2026-05-05",
    "phase": "phase4_person_profile",
    "data_sources": [
      "official_website",
      "news_search",
      "web_search"
    ],
    "completeness_score": 69,
    "notes": "出生年份（1969年）来源于韩国媒体报道（연합인포맥스），出生月份和日期不可考，使用-01占位。精确入职日期和早期职业起止时间缺乏公开记录，部分work_experience条目未标注具体日期。未发现其社交媒体账号及家庭信息。简历基于KIC官网、Milken Institute演讲者资料、MarketScreener、多家韩媒报道交叉验证。已确认CFA持证人身份（MarketScreener）。",
    "quotes": [
      {
        "title": "KIC Executive Management - Hoon Lee Profile",
        "url": "https://www.kic.kr/en/about-kic/organization/executives"
      },
      {
        "title": "Milken Institute Asia Summit 2025 - Hoon Lee Speaker Bio",
        "url": "https://milkeninstitute.org/events/asia-summit-2025/speakers/hoon-lee"
      },
      {
        "title": "KIC appoints Hoon Lee as CIO - Markets Group",
        "url": "https://www.marketsgroup.org/news/kic-appoints-hoon-lee-as-cio"
      },
      {
        "title": "KIC signals first CIO reappointment - ChosunBiz",
        "url": "https://biz.chosun.com/en/en-finance/2026/01/29/R332UYD7ZVFMVMXNXWKURETETI/"
      },
      {
        "title": "KIC Moves to TPA Amid Market Volatility - Markets Group",
        "url": "https://www.marketsgroup.org/news/kic-moves-to-tpa-amid-market-volatility-targets-ai-for-growth"
      },
      {
        "title": "Hoon Lee CIO 연임설 - 한국경제",
        "url": "https://www.hankyung.com/article/2025071460201"
      },
      {
        "title": "KIC 신임 CIO 이훈 선임 - 연합인포맥스",
        "url": "https://news.einfomax.co.kr/news/articleView.html?idxno=4227442"
      },
      {
        "title": "KIC 이훈 신임 CIO 선임 - 서울경제 시그널",
        "url": "https://signal.sedaily.com/article/13462535"
      },
      {
        "title": "Hoon Lee Profile - MarketScreener",
        "url": "https://www.marketscreener.com/insider/HOON-LEE-A0TPSM/"
      },
      {
        "title": "KIC CIO 이훈 임명 - 이코노뉴스",
        "url": "https://www.econonews.co.kr/news/articleView.html?idxno=256789"
      },
      {
        "title": "KIC 2025 return report - ChosunBiz",
        "url": "https://biz.chosun.com/en/en-finance/2026/02/23/CZYS2MLWSVBG3GUWIQBUMUHY2Y/"
      }
    ]
  }
}
