{
  "person_id": "JP-PERSON-000439",
  "wikidata_qid": null,
  "name_zh": "内藤裕子",
  "name": "内藤裕子",
  "name_en": "Yuko Naito",
  "aliases": [
    "ないとう ゆうこ",
    "Naito Yuko",
    "内藤 裕子"
  ],
  "nationality": "JP",
  "gender": "female",
  "birth_date": null,
  "birth_place": null,
  "contacts": [],
  "current_positions": [
    "国际特赦组织日本分会理事长",
    "公益社团法人国际特赦组织日本理事长"
  ],
  "education": [],
  "work_experience": [
    {
      "start_date": null,
      "end_date": null,
      "organization": "国际特赦组织日本分会（アムネスティ・インターナショナル日本）",
      "org_id": "JP-NGO-002",
      "position": "会员（志愿者，至少2024年5月起参与名古屋地区人权视察活动）"
    },
    {
      "start_date": null,
      "end_date": null,
      "organization": "国际特赦组织日本分会（アムネスティ・インターナショナル日本）",
      "org_id": "JP-NGO-002",
      "position": "理事长（公益社团法人代表理事）"
    }
  ],
  "person_relationships": [
    {
      "person_id": "JP-PERSON-000440",
      "person_name": "田嶋俊博（田嶋 俊博）",
      "relationship_type": "colleague",
      "description": "国际特赦组织日本分会事務局長（秘书长），与内藤裕子同为法人代表层。2026年6月因被工会指控对职工实施权力骚扰，工会同时要求田嶋与内藤二人辞任。"
    },
    {
      "person_id": null,
      "person_name": "北井大辅（北井 ⼤輔）",
      "relationship_type": "colleague",
      "description": "国际特赦组织日本分会副理事长，在内藤裕子理事长领导下共事。"
    },
    {
      "person_id": null,
      "person_name": "宫村悠未（宮村 悠未）",
      "relationship_type": "colleague",
      "description": "国际特赦组织日本分会副理事长兼骚扰相谈员，在内藤裕子理事长领导下共事。"
    },
    {
      "person_id": "JP-PERSON-000442",
      "person_name": "大福美穗（大福 美穂）",
      "relationship_type": "subordinate",
      "description": "国际特赦组织日本分会东京事务所职工（会员管理等岗位），2025年9月因适应障碍休职，是2026年骚扰骚动的主要告发者；内藤裕子作为理事长曾就其投诉对全体职工进行听证并将内容反馈给事務局长。"
    }
  ],
  "social_accounts": [],
  "family_members": [],
  "political_stances": [],
  "major_achievements": [
    {
      "date": "2024-05-31",
      "organization": "国际特赦组织日本分会（アムネスティ・インターナショナル日本）",
      "achievement": "以会员身份参与爱知县精神医疗中心参访活动，并与津田秀一共同撰写参访报告，关注精神医疗体系中人身拘束、保护室长期隔离、治疗同意权等患者人权议题。"
    },
    {
      "date": "2025",
      "organization": "国际特赦组织日本分会（アムネスティ・インターナショナル日本）",
      "achievement": "担任国际特赦组织日本分会理事长（公益社团法人代表理事），主持理事会工作。在其任内受理职工关于事務局长权力骚扰的投诉，亲自对全体职工进行听证并将内容反馈，推动理事会于2026年1月决定由外部律师启动独立调查。"
    }
  ],
  "biography_summary": "内藤裕子（内藤 裕子／ないとう ゆうこ，英文名 Yuko Naito），日本国籍，现任公益社团法人国际特赦组织日本（アムネスティ・インターナショナル日本，即 Amnesty International 日本分会）理事长（代表理事），是该国际人权 NGO 日本支部的最高决策负责人。她长期以会员（志愿者）身份参与国际特赦组织日本的人权活动，曾于2024年5月作为会员代表参与爱知县精神医疗中心的实地参访，关注精神医疗患者人权、长期拘束与治疗同意权等议题，并执笔参访报告。在担任理事长期间，她主持理事会，副理事长为北井大辅与宫村悠未，事務局長（秘书长）为田嶋俊博。2025年至2026年间，国际特赦组织日本分会爆发事務局長权力骚扰争议，工会指控事務局长对多名职工实施暴言、怒吼、无视等行为，造成职工休職与退职；工会以理事会（含内藤理事长）未能采取有效劳动环境改善措施为由，要求内藤裕子与田嶋俊博同时辞任。内藤方面则通过理事会推动由独立第三方律师进行调查，并表示将依据调查结果妥善应对。其个人学历、职业经历与家庭信息目前无公开资料。",
  "profile": null,
  "collection_meta": {
    "collection_date": "2026-06-17",
    "phase": "phase4_person_profile",
    "data_sources": [
      "official_website",
      "news_search",
      "web_search",
      "government_registry"
    ],
    "completeness_score": 43,
    "notes": "姓名核实：经国际特赦组织日本官方「アムネスティ日本とは」领导层页面（amnesty.or.jp/about_us/aij/）以及日本内阁府关联 NPO 数据库 CANPAN（团体ID 1560556514）双重独立确认，代表者（理事长）姓名为「内藤 裕子」（ふりがな：ないとう ゆうこ），与任务提示完全一致，无需调整；name 字段使用日语官方记录，aliases 补充假名读音与罗马字。关键发现：(1) 现任国际特赦组织日本分会理事长（公益社团法人代表理事）；(2) 至少自2024年5月起即以普通会员（志愿者）身份积极参与名古屋地区人权活动（爱知县精神医疗中心参访报告文责署名）；(3) 任内爆发2025-2026年事務局长田嶋俊博权力骚扰骚动，工会要求其与田嶋同时辞任，理由为「未采取有效劳动环境改善措施」；(4) 副理事长为北井大辅、宫村悠未，事務局长为田嶋俊博（JP-PERSON-000440），告发职工大福美穗（JP-PERSON-000442）。重要区分：日语 Wikipedia 存在另一位同名「内藤裕子」（1976年生，前 NHK 播音员，东京女子大学毕业，隶属 FIRST AGENT），与本条目人物无关，已在采集中明确排除。存疑字段：出生日期、出生地、学历、加入国际特赦组织前的职业经历均无公开资料，education/birth_date/birth_place 留空；未检索到本人认证社交账号（国际特赦组织日本机构账号 @amnesty_or_jp 为组织账号非个人），social_accounts 留空数组；家庭信息无公开报道，family_members 留空数组。引用来源涵盖国际特赦组织日本官网、CANPAN 内阁府关联数据库、每日新闻、朝日新闻、东京新闻等4个以上独立来源交叉验证。",
    "quotes": [
      {
        "title": "アムネスティ日本とは : アムネスティ日本 Amnesty（官方领导层页面，役員構成）",
        "url": "https://www.amnesty.or.jp/about_us/aij/"
      },
      {
        "title": "公益社団法人アムネスティ・インターナショナル日本（団体id：1560556514）／団体情報 | CANPAN（内阁府关联NPO数据库）",
        "url": "https://fields.canpan.info/organization/detail/1560556514?view=pc"
      },
      {
        "title": "人権団体で「パワハラ」騒動 職員6人が被害訴え 休職者も｜毎日新聞 2026年6月4日",
        "url": "https://mainichi.jp/articles/20260603/k00/00m/040/207000c"
      },
      {
        "title": "人権団体でパワハラ？ アムネスティ日本の労組、事務局長の更迭要求｜朝日新聞 2026年6月4日",
        "url": "https://www.asahi.com/articles/ASV6332B7V63ULFA01DM.html"
      },
      {
        "title": "国際人権組織「アムネスティ日本」でパワハラ疑惑、職員「罵倒された」と訴え 労組が事務局長らの解任を要求｜東京新聞 2026年6月4日",
        "url": "https://www.tokyo-np.co.jp/article/492694"
      },
      {
        "title": "【活動報告】愛知県精神医療センター参観報告（内藤裕子署名参访报告）｜アムネスティ日本 2024年6月19日",
        "url": "https://www.amnesty.or.jp/hrc/2024/0619_10371.html"
      }
    ]
  }
}
