{
  "person_id": "JP-PERSON-000390",
  "wikidata_qid": null,
  "name_zh": "花田早织",
  "name": "花田さおり",
  "name_en": "Saori Hanada",
  "aliases": [
    "花田紗織",
    "花田纱织",
    "Hanada Saori"
  ],
  "nationality": "JP",
  "gender": "female",
  "birth_date": null,
  "birth_place": null,
  "contacts": [
    {
      "type": "website",
      "value": "https://www.aplawjapan.com/professionals/saori-hanada",
      "source": "渥美坂井法律事務所公式プロフィール"
    }
  ],
  "current_positions": [
    "渥美坂井法律事務所・外国法共同事業 パートナー弁護士",
    "株式会社フジ・メディア・ホールディングス 社外取締役（監査等委員）",
    "株式会社フジテレビジョン 社外取締役"
  ],
  "education": [
    {
      "start_date": "1990",
      "end_date": "1992",
      "institution": "早稻田大学 (早稲田大学)",
      "degree": "bachelor",
      "field": "政治经济学"
    },
    {
      "start_date": "1993",
      "end_date": "1995",
      "institution": "早稻田大学 (早稲田大学)",
      "degree": "master",
      "field": "政治学"
    },
    {
      "start_date": "2009",
      "end_date": "2010",
      "institution": "哥伦比亚大学法学院 (Columbia Law School)",
      "degree": "master",
      "field": "法学（LL.M.）"
    }
  ],
  "work_experience": [
    {
      "start_date": "2000-04",
      "end_date": "2007-04",
      "organization": "森田・山田法律事務所 (森田・山田法律事務所)",
      "org_id": null,
      "position": "弁護士"
    },
    {
      "start_date": "2007",
      "end_date": null,
      "organization": "渥美坂井法律事務所・外国法共同事业 (渥美坂井法律事務所・外国法共同事業)",
      "org_id": null,
      "position": "合伙人弁護士"
    },
    {
      "start_date": "2010-09",
      "end_date": "2011-03",
      "organization": "KhattarWong LLP (KhattarWong LLP)",
      "org_id": null,
      "position": "外籍律师（新加坡）"
    },
    {
      "start_date": "2025-06-25",
      "end_date": null,
      "organization": "富士媒体控股 (株式会社フジ・メディア・ホールディングス)",
      "org_id": null,
      "position": "社外取缔役（监查等委员）"
    },
    {
      "start_date": "2025-06-25",
      "end_date": null,
      "organization": "富士电视台 (株式会社フジテレビジョン)",
      "org_id": "JP-MEDIA-006",
      "position": "社外取缔役"
    }
  ],
  "person_relationships": [
    {
      "person_id": null,
      "person_name": "清水贤治 (清水賢治)",
      "relationship_type": "colleague",
      "description": "富士媒体控股代表取缔役社长，与花田同属董事会成员"
    }
  ],
  "social_accounts": [],
  "family_members": [],
  "political_stances": [],
  "major_achievements": [
    {
      "date": "2025-06-25",
      "organization": "富士媒体控股 (株式会社フジ・メディア・ホールディングス)",
      "achievement": "经大股东（东京角川、_eff Associates 等）提案，作为外部董事候补当选富士媒体控股社外取缔役（监查等委员），任期至2027年定期股东总会结束，旨在强化公司治理改革"
    },
    {
      "date": "2025-06-25",
      "organization": "富士电视台 (株式会社フジテレビジョン)",
      "achievement": "同时兼任富士电视台社外取缔役，参与富士集团治理结构改革"
    },
    {
      "date": "2012",
      "organization": null,
      "achievement": "取得美国纽约州律师资格，具备日美跨境法律实务能力"
    }
  ],
  "biography_summary": "花田早织（花田さおり，Saori Hanada）是日本资深律师，专长于竞争法（独占禁止法）、企业并购、隐私数据保护及医药品规制等领域，现任渥美坂井法律事务所・外国法共同事业合伙人。1992年早稻田大学政治经济学部毕业，1995年获同校政治学硕士，2010年获哥伦比亚大学法学硕士（LL.M.），2012年取得纽约州律师资格。曾任森田・山田法律事务所及新加坡 KhattarWong LLP 律师。长期在 Chambers、Who's Who Legal、Best Lawyers、asialaw 等国际法律评级中入选日本竞争法领域领先律师。2025年6月25日，经富士媒体控股大股东提案，作为外部董事候补与澤田貴司、堀内勉、柳敦史一同当选社外取缔役（监查等委员），同时兼任富士电视台社外取缔役，任期至2027年。此次人事被视为富士集团在公司治理改革与资产组合调整背景下强化外部监督的重要举措。其姓名初值「花田纱织 / 花田紗織」经官方页面核实有误，实际姓名为平假名「花田さおり」。",
  "profile": null,
  "collection_meta": {
    "collection_date": "2026-06-18",
    "phase": "phase4_person_profile",
    "data_sources": [
      "official_website",
      "wikipedia",
      "news_search",
      "web_search",
      "annual_report"
    ],
    "completeness_score": 78,
    "notes": "姓名核实：经富士媒体控股官方役员页面（fujimediahd.co.jp）、富士电视台官方役员页面（fujitv.co.jp）及渥美坂井法律事务所官方profile三方确认，真实姓名为「花田さおり」（平假名），任务清单初值「花田纱织 / 花田紗織」为OCR误读，已将原名写入name字段，提示名加入aliases。中文名「花田早织」为华文媒体对日本女性名「さおり」的常用汉字译名（参照读卖/朝日华文报道惯例）。关键发现：该人物主业为渥美坂井法律事务所合伙人律师，专长竞争法；2025年6月经大股东提案当选富士媒体控股社外取缔役（兼监查等委员）及富士电视台社外取缔役，系富士集团治理改革重要人事。存疑字段：出生日期、出生地、家庭信息无公开来源披露，留空。person_relationships仅填写已知确切同事关系；search_accounts无公开SNS账号。引用来源含富士媒体HD与富士电视官方、渥美坂井事务所profile、Business Lawyers名鉴、媒体创新、encount.press、irbank有价证券报告书第84期等。",
    "quotes": [
      {
        "title": "役員一覧｜フジ・メディア・ホールディングス（公式）",
        "url": "https://www.fujimediahd.co.jp/corporate/executives.html"
      },
      {
        "title": "役員一覧｜企業情報 - フジテレビ（公式）",
        "url": "https://www.fujitv.co.jp/company/info/yakuin.html"
      },
      {
        "title": "花田 さおり｜渥美坂井法律事務所・外国法共同事業（公式プロフィール）",
        "url": "https://www.aplawjapan.com/professionals/saori-hanada"
      },
      {
        "title": "花田さおり弁護士 ／経歴・取扱案件・著作 - BUSINESS LAWYERS",
        "url": "https://www.businesslawyers.jp/lawyers/27579"
      },
      {
        "title": "フジ・メディアHD、6月25日付の新役員体制を内定 - メディアイノベーション",
        "url": "https://media-innovation.jp/article/2026/05/20/143355.html"
      },
      {
        "title": "4676 フジ・メディアHD | 役員の状況 - 有価証券報告書第84期（irbank）",
        "url": "https://irbank.net/E04462/notes/InformationAboutOfficersTextBlock?f=S100W5GP"
      },
      {
        "title": "フジの親会社FMH、大株主の提案にゼロ回答で11人の新取締役 - エンカウント",
        "url": "https://encount.press/archives/797228/"
      }
    ]
  }
}