{
  "person_id": "UZ-PERSON-000056",
  "wikidata_qid": null,
  "name_zh": "米尔扎-乌鲁格别克·阿布杜萨洛莫夫",
  "name": "Mirza-Ulugʻbek Elchiyevich Abdusalomov",
  "name_en": "Mirza-Ulugbek Abdusalomov",
  "aliases": [
    "Mirzo-Ulugʻbek Abdusalomov",
    "Mirzo Ulug'bek Abdusalomov",
    "Абдусаломов Мирза-Улуғбек Элчиевич",
    "Мирзо-Улугбек Абдусаломов"
  ],
  "nationality": "UZ",
  "gender": "male",
  "birth_date": "1952-02-14",
  "birth_place": "锡尔河州 (Sirdaryo viloyati)",
  "contacts": [],
  "current_positions": [
    "乌兹别克斯坦宪法法院院长",
    "亚洲宪法法院及同类机构协会主席（2025-2027年度）"
  ],
  "education": [
    {
      "start_date": "1971",
      "end_date": "1975",
      "institution": "塔什干国立大学 (Toshkent davlat universiteti)",
      "field": "法学（法学专业/法律工作者）"
    }
  ],
  "work_experience": [
    {
      "start_date": "1969",
      "end_date": "1971",
      "organization": "锡尔河州扬吉耶尔市消防队 (Yangiyer shahar o't o'chirish qismi)",
      "org_id": null,
      "position": "高级指导员"
    },
    {
      "start_date": "1975",
      "end_date": "1978",
      "organization": "锡尔河州检察院 (Sirdaryo viloyati prokuraturasi)",
      "org_id": null,
      "position": "见习员、侦查局检察员"
    },
    {
      "start_date": "1978",
      "end_date": "1981",
      "organization": "锡尔河州检察院 (Sirdaryo viloyati prokuraturasi)",
      "org_id": null,
      "position": "州检察长未成年人事务高级助理、干部事务高级助理"
    },
    {
      "start_date": "1981",
      "end_date": "1982",
      "organization": "锡尔河州梅赫纳托博德区法院 (Mehnatobod tumani sudi)",
      "org_id": null,
      "position": "院长"
    },
    {
      "start_date": "1982",
      "end_date": "1989",
      "organization": "锡尔河州党委、乌兹别克共产党中央委员会 (Sirdaryo viloyat qo'mitasi; O'zbekiston Kompartiyasi Markaziy Qo'mitasi)",
      "org_id": "UZ-GOV-032",
      "position": "州委行政、商业与财政机关部指导员、部长，乌共中央行政机关部副部长"
    },
    {
      "start_date": "1989",
      "end_date": "1995",
      "organization": "乌兹别克斯坦司法部 (Adliya vazirligi)",
      "org_id": "UZ-GOV-017",
      "position": "副部长、第一副部长（期间曾代理部长职责）"
    },
    {
      "start_date": "1995",
      "end_date": "2004",
      "organization": "乌兹别克斯坦最高经济法院 (Oliy xo'jalik sudi)",
      "org_id": null,
      "position": "院长"
    },
    {
      "start_date": "2004",
      "end_date": "2005",
      "organization": "乌兹别克斯坦宪法法院 (Konstitutsiyaviy sud)",
      "org_id": "UZ-GOV-007",
      "position": "院长（第一任期）"
    },
    {
      "start_date": "2005-05-07",
      "end_date": "2021-02-05",
      "organization": "乌兹别克斯坦中央选举委员会 (Markaziy saylov komissiyasi)",
      "org_id": "UZ-GOV-011",
      "position": "主席"
    },
    {
      "start_date": "2021-02-05",
      "end_date": null,
      "organization": "乌兹别克斯坦宪法法院 (Konstitutsiyaviy sud)",
      "org_id": "UZ-GOV-007",
      "position": "法官、院长（2026年2月6日经参议院再次当选法官，任期10年）"
    }
  ],
  "person_relationships": [
    {
      "person_id": "UZ-PERSON-000525",
      "person_name": "巴赫季约尔·米尔博巴耶夫 (Baxtiyor Mirboboyev)",
      "relationship_type": "colleague",
      "description": "2004-2005年阿布杜萨洛莫夫首次卸任宪法法院院长后，米尔博巴耶夫继任院长；2021年2月5日宪法法院会议上米尔博巴耶夫被解除职务，阿布杜萨洛莫夫当选继任，开启第二个院长任期。"
    },
    {
      "person_id": "UZ-PERSON-000526",
      "person_name": "扎伊尼金·尼扎姆霍贾耶夫 (Zayniddin Nizomxo'jayev)",
      "relationship_type": "colleague",
      "description": "2021年2月阿布杜萨洛莫夫卸任中央选举委员会主席并转任宪法法院法官后，时任参议院副议长尼扎姆霍贾耶夫被任命为中央选举委员会继任主席。"
    }
  ],
  "social_accounts": [],
  "family_members": [],
  "political_stances": [
    {
      "date": "2026-08-16",
      "topic": "宪法法院立法完善",
      "stance_content": "2026年8月14日在总统与最高法院、宪法法院、最高司法委员会负责人会晤后接受「乌兹别克斯坦24」电视台采访时表示，正与法学界及立法院共同起草一部全面涵盖宪法法院全部活动的新法律，草案已接近完成、近期将提交议会；这将是十年来对宪法法院立法的第三次修订（此前为2017年和2021年）。",
      "source": "https://www.gazeta.uz/ru/2026/08/16/constitutional-court-uzb/"
    },
    {
      "date": "2026-08-16",
      "topic": "人权保障与「正义-2030」司法战略",
      "stance_content": "称2023年通过的新版宪法的主要目标是「崇扬人的尊严」，总统政策亦以此为方向，保护法院系统中的人权是当前尤为迫切的课题；同时承认司法系统仍存在不足，但表示此次会晤「公开、直率地」讨论了问题并确定了整改措施。",
      "source": "https://www.gazeta.uz/ru/2026/08/16/constitutional-court-uzb/"
    },
    {
      "date": "2026-08-16",
      "topic": "宪法法院开放性",
      "stance_content": "主张通过新立法使宪法法院「更贴近人民」，以法律形式固定法院「向所有人敞开大门」的开放原则，把「人的因素」置于首位，保障宪法和法律的最高地位。",
      "source": "https://www.gazeta.uz/ru/2026/08/16/constitutional-court-uzb/"
    }
  ],
  "major_achievements": [
    {
      "date": "2021-02-05",
      "achievement": "在执掌中央选举委员会逾15年后卸任，同日经参议院全体会议当选宪法法院法官，并在法院会议上当选院长，接替被解职的巴赫季约尔·米尔博巴耶夫，开启第二个宪法法院院长任期。",
      "organization": "乌兹别克斯坦宪法法院 (Konstitutsiyaviy sud)"
    },
    {
      "date": "2024-01",
      "achievement": "其任内推动的宪法法院法修正案获总统签署：法官任期由5年改为10年且不得连任，并取消同一人担任宪法法院法官不得超过两次的限制，法院另获得对提交全民公决问题的合宪性作出结论的权力。",
      "organization": "乌兹别克斯坦宪法法院 (Konstitutsiyaviy sud)"
    },
    {
      "date": "2025-11-11",
      "achievement": "正式就任亚洲宪法法院及同类机构协会（AACC）2025-2027年度主席，乌兹别克斯坦宪法法院自泰国宪法法院手中接任协会主席国，并在宪法法院成立30周年国际会议上宣示就任。",
      "organization": "乌兹别克斯坦宪法法院 (Konstitutsiyaviy sud)"
    },
    {
      "date": "2026-02-06",
      "achievement": "在2024年新任期制度（10年任期、不得连任）下经参议院第十三次全体会议再次当选宪法法院法官，任期10年；最高司法委员会随后声明称赞其40余年职业生涯对国家法律体系建设贡献显著。",
      "organization": "乌兹别克斯坦宪法法院 (Konstitutsiyaviy sud)"
    }
  ],
  "biography_summary": "米尔扎-乌鲁格别克·埃尔奇耶维奇·阿布杜萨洛莫夫（乌兹别克语亦作 Mirzo-Ulugʻbek），1952年2月14日生于锡尔河州，乌兹别克斯坦法学家、「乌兹别克斯坦功勋法律工作者」，法学副博士，国家二级司法顾问。1971-1975年就读于塔什干国立大学（今米尔扎·兀鲁伯乌兹别克斯坦国立大学）法学专业。1969年参加工作，早年历任消防队指导员、锡尔河州检察院侦查与检察职务、区法院院长，1982-1989年在州党委和乌共中央行政机关部门任职，1989-1995年任司法部副部长、第一副部长（曾代理部长），1995-2004年任最高经济法院院长，2004-2005年首次出任宪法法院院长，2005年5月至2021年2月执掌中央选举委员会逾15年，主持了卡里莫夫执政后期及米尔济约耶夫执政初期的历次大选与公投。2021年2月5日再度出任宪法法院院长并任法官至今；2026年2月在新法官任期制下再次当选（任期10年）。2025年11月起兼任亚洲宪法法院及同类机构协会（AACC）主席（2025-2027年度），任内推动2024年宪法法院法修订和2026年新宪法法院法起草，主张宪法法院「以人为先」、强化人权保障并向公众开放。",
  "profile": {
    "source_url": "https://www.konstsud.uz/uploads/2021/03/21781798738de326b885a32dfbf54ba7.jpg",
    "local_path": "photos/UZ-PERSON-000056.jpg"
  },
  "collection_meta": {
    "collection_date": "2026-09-30",
    "phase": "phase4_person_profile",
    "data_sources": [
      "official_website",
      "wikipedia",
      "news_search",
      "web_search"
    ],
    "completeness_score": 68,
    "notes": "关键事实（出生年份1952、教育背景、1995-2004最高经济法院院长、2004-2005及2021至今宪法法院院长、2005-2021中央选举委员会主席、2026-02-06再次当选法官）均经乌兹别克斯坦宪法法院官网、uz.wikipedia、Gazeta.uz、Kun.uz、Qalampir.uz等多来源交叉验证。任务提示中「2023年新宪法体制下首任院长」说法不成立：其现任院长任期始于2021年2月5日（2023年宪法改革之前），并在新宪法体制下留任至今；2026年2月依据2024年1月修正的新法官任期制再次当选法官。出生精确日期1952-02-14仅见于uz.wikipedia（年份经Gazeta.uz/Kun.uz/Qalampir.uz确认），精确到日为单一来源。学历「法学副博士（yuridik fanlar nomzodi）」及「国家二级司法顾问」头衔见于uz.wikipedia与Qalampir.uz，但授予院校及年份未见公开资料，故未单列教育条目。家庭信息与个人社交媒体账号未检索到可靠公开资料（Facebook/Instagram相关结果均为媒体报道账号而非本人账户），family_members与social_accounts留空。Wikidata未收录该人物，wikidata_qid为null。最高经济法院、锡尔河州检察院、区法院及党委机关在_name_index.json中无对应条目，org_id写null。；2026-10-02: 补弱研究：头像取自宪法法院官网「法院组成」页院长条目（Абдусаломов Мирза-Улуғбек Элчиевич）官方照片，已下载至photos/UZ-PERSON-000056.jpg并验证JPEG文件头；社交账号复查：Facebook/Instagram/LinkedIn/X检索结果均为媒体报道或机构账号，未见任何本人账户，social_accounts维持留空。",
    "quotes": [
      {
        "title": "Состав суда — Конституционный суд Республики Узбекистан (官网现任院长页)",
        "url": "https://www.konstsud.uz/ru/managements/sud-tarkibi"
      },
      {
        "title": "Mirzo-Ulugʻbek Abdusalomov — Vikipediya (uz.wikipedia.org)",
        "url": "https://uz.wikipedia.org/wiki/Mirzo-Ulug%CA%BBbek_Abdusalomov"
      },
      {
        "title": "Почему судья Конституционного суда может быть старше 70 лет — разъяснение Высшего судейского совета — Gazeta.uz (2026-02-10)",
        "url": "https://www.gazeta.uz/ru/2026/02/10/judge/"
      },
      {
        "title": "Мирзо-Улугбек Абдусаломов повторно избран судьей Конституционного суда — Kun.uz (2026-02-06)",
        "url": "https://kun.uz/ru/news/2026/02/06/mirzo-ulugbek-abdusalomov-povtorno-izbran-sudey-konstitutsionnogo-suda"
      },
      {
        "title": "Мирза-Улугбек Абдусаломов избран судьёй Конституционного суда — Gazeta.uz (2021-02-05)",
        "url": "https://www.gazeta.uz/ru/2021/02/05/court/"
      },
      {
        "title": "В Узбекистане готовят новый закон о Конституционном суде — Gazeta.uz (2026-08-16)",
        "url": "https://www.gazeta.uz/ru/2026/08/16/constitutional-court-uzb/"
      },
      {
        "title": "Mirzo-Ulug'bek Abdusalomov Konstitutsiyaviy sudning sudyasi lavozimiga qayta saylandi — Qalampir.uz (2026-02-06)",
        "url": "https://qalampir.uz/uz/news/mirzo-ulugbek-abdusalomov-uzbekiston-konstitutsiyaviy-sudining-sud-yasi-buldi-131385"
      },
      {
        "title": "Mirzo Ulug'bek Abdusalomov Konstitutsiyaviy sud raisi etib saylandi — Qalampir.uz (2021-02-05)",
        "url": "https://qalampir.uz/uz/n/32812"
      },
      {
        "title": "Mirzo-Ulug'bek Abdusalomov Konstitutsiyaviy sud raisi etib saylandi — Gazeta.uz oz (2021-02-05)",
        "url": "https://www.gazeta.uz/oz/2021/02/05/constitution"
      },
      {
        "title": "Chairperson of the Constitutional Court officially assumed the mandate as President of AACC for 2025-2027 — konstsud.uz (2026-01-08)",
        "url": "https://www.konstsud.uz/en/news/2026/01/08/chairperson-of-the-constitutional-court-of-the-republic-of-uzbekistan-abdusalomov-mirza-ulugbek-officially-assumed-the-mandate-as-president-of-the-association-of-asian-constitutional-courts-and-equivalent-institutions-aacc-for-the-term-2025-2027"
      },
      {
        "title": "Мирзо-Улугбек Абдусаломов избран судьей Конституционного суда — UzNews/Kursiv (2026-02-06)",
        "url": "https://uz.kursiv.media/2026-02-06/mirzo-ulugbek-abdusalomov-izbran-sudej-konstituczionnogo-suda/"
      }
    ]
  }
}