{
  "person_id": "MX-PERSON-000015",
  "wikidata_qid": "Q133243453",
  "name_zh": "埃德加·阿马多尔·萨莫拉",
  "name": "Edgar Amador Zamora",
  "name_en": "Edgar Abraham Amador Zamora",
  "aliases": [
    "Edgar Abraham Amador Zamora",
    "Édgar Amador Zamora"
  ],
  "nationality": "MX",
  "gender": "male",
  "birth_date": "1967-07-23",
  "birth_place": "蒙克洛瓦 (Monclova, Coahuila)",
  "contacts": [],
  "current_positions": [
    "财政和公共信贷部 (Secretaría de Hacienda y Crédito Público) 部长"
  ],
  "education": [
    {
      "institution": "墨西哥国立自治大学 (Universidad Nacional Autónoma de México / UNAM)",
      "degree": "bachelor",
      "field": "经济学",
      "start_date": "1985",
      "end_date": "1991"
    },
    {
      "institution": "墨西哥学院 (El Colegio de México)",
      "degree": "master",
      "field": "经济学",
      "start_date": "1992",
      "end_date": "1994"
    }
  ],
  "work_experience": [
    {
      "start_date": "2000",
      "end_date": null,
      "organization": "Vector证券经纪公司 (Vector Casa de Bolsa)",
      "org_id": "MX-GOV-034",
      "position": "分析师"
    },
    {
      "start_date": null,
      "end_date": null,
      "organization": "Stone & McCarthy研究公司 (Stone & McCarthy)",
      "org_id": "MX-GOV-035",
      "position": "墨西哥和巴西经济分析师"
    },
    {
      "start_date": null,
      "end_date": null,
      "organization": "德克夏银行 (Dexia Banque)",
      "org_id": "MX-GOV-036",
      "position": "墨西哥副总经理"
    },
    {
      "start_date": null,
      "end_date": null,
      "organization": "联邦区财政管理总局 (Dirección General de Administración Financiera del Distrito Federal)",
      "org_id": "MX-GOV-037",
      "position": "总局长"
    },
    {
      "start_date": null,
      "end_date": null,
      "organization": "生活质量、进步与城市发展公司 (Calidad de Vida, Progreso y Desarrollo para la Ciudad de México)",
      "org_id": "MX-ACAD-001",
      "position": "总局长"
    },
    {
      "start_date": null,
      "end_date": null,
      "organization": "墨西哥银行 (Banco de México)",
      "org_id": "MX-GOV-027",
      "position": "行长顾问"
    },
    {
      "start_date": null,
      "end_date": null,
      "organization": "墨西哥城政府 (Gobierno de la Ciudad de México)",
      "org_id": "MX-ACAD-001",
      "position": "金融规划副秘书"
    },
    {
      "start_date": "2012-12-05",
      "end_date": "2018-04-24",
      "organization": "墨西哥城财政秘书处 (Secretaría de Finanzas de la Ciudad de México)",
      "org_id": "MX-ACAD-006",
      "position": "财政部长"
    },
    {
      "start_date": "2021",
      "end_date": null,
      "organization": "墨西哥国立自治大学经济学院 (Facultad de Economía, UNAM)",
      "org_id": "MX-ACAD-001",
      "position": "教授"
    },
    {
      "start_date": "2024-10-01",
      "end_date": "2025-03-07",
      "organization": "财政和公共信贷部 (Secretaría de Hacienda y Crédito Público)",
      "org_id": "MX-GOV-009",
      "position": "副部长"
    },
    {
      "start_date": "2025-03-08",
      "end_date": null,
      "organization": "财政和公共信贷部 (Secretaría de Hacienda y Crédito Público)",
      "org_id": "MX-GOV-009",
      "position": "部长"
    }
  ],
  "person_relationships": [
    {
      "person_id": "MX-PERSON-000013",
      "person_name": "克劳迪娅·辛鲍姆 (Claudia Sheinbaum Pardo)",
      "relationship_type": "superior",
      "description": "辛鲍姆总统于2025年3月任命阿马多尔为财政部长，此前他也曾在辛鲍姆担任墨西哥城市长期间受到其领导"
    },
    {
      "person_id": "MX-PERSON-000032",
      "person_name": "罗赫里奥·拉米雷斯·德拉奥 (Rogelio Ramírez de la O)",
      "relationship_type": "superior",
      "description": "阿马多尔在2024年10月至2025年3月期间担任拉米雷斯·德拉奥领导下的财政部副部长，接替其升任部长"
    },
    {
      "person_id": "MX-PERSON-000025",
      "person_name": "米格尔·安赫尔·曼塞拉 (Miguel Ángel Mancera)",
      "relationship_type": "superior",
      "description": "阿马多尔在2012年至2018年期间担任曼塞拉政府下的墨西哥城财政部长"
    }
  ],
  "social_accounts": [
    {
      "platform": "twitter_x",
      "account_name": "@Edgar_Amador_Z",
      "url": "https://x.com/Edgar_Amador_Z",
      "source": "https://www.eluniversal.com.mx/cartera/edgar-amador-activa-su-cuenta-oficial-en-redes-sociales-como-nuevo-secretario-de-hacienda-elimina-su-perfil-personal/"
    }
  ],
  "family_members": [],
  "political_stances": [
    {
      "date": "2025-03",
      "topic": "财政政策与经济稳定",
      "stance_content": "阿马多尔在就任财政部长后表示将致力于减少财政赤字、维持宏观经济稳定，并强调与私营部门加强合作的重要性。他还强调数字化税务流程和优化新收入来源的重要性。",
      "source": "https://www.as-coa.org/speakers/edgar-amador-zamora"
    },
    {
      "date": "2025-03",
      "topic": "美墨关税争端",
      "stance_content": "在美墨关税紧张背景下接任财政部长，阿马多尔承诺将致力于稳定经济，应对美国关税政策带来的不确定性。他代表墨西哥出席了2025年G20峰会。",
      "source": "https://news.qq.com/rain/a/20250308A0638800"
    },
    {
      "date": "2026-02",
      "topic": "打击金融犯罪",
      "stance_content": "在金融行动特别工作组（FATF）第五次全体会议上，阿马多尔表示墨西哥承诺持续强化机构能力，与国际社会协同打击金融犯罪及相关活动。",
      "source": "https://www.mexicohuawentime.com/static/content/MXGXW/2026-02-13/1471866439504891904.html"
    },
    {
      "date": "2025-11",
      "topic": "公共债务管理",
      "stance_content": "阿马多尔为政府的债务管理方式进行辩护，表示到2025年底公共债务预计占GDP的52.3%属于可接受水平。",
      "source": "https://www.mxhuaren.com/noticias/4645.html"
    }
  ],
  "major_achievements": [
    {
      "date": "2025-03-08",
      "achievement": "被总统克劳迪娅·辛鲍姆任命为财政和公共信贷部部长，并于3月12日获参议院批准",
      "organization": "财政和公共信贷部 (Secretaría de Hacienda y Crédito Público)"
    },
    {
      "date": "2025-11",
      "achievement": "代表墨西哥出席在南非约翰内斯堡举行的G20领导人峰会",
      "organization": null
    },
    {
      "date": "2012",
      "achievement": "担任墨西哥城财政部长期间，领导城市收费公路融资项目、地铁2号线列车采购、监狱建设融资方案，并推动地方税制现代化",
      "organization": "墨西哥城财政秘书处 (Secretaría de Finanzas de la Ciudad de México)"
    }
  ],
  "biography_summary": "埃德加·亚伯拉罕·阿马多尔·萨莫拉（Edgar Abraham Amador Zamora），1967年7月23日出生于墨西哥科阿韦拉州蒙克洛瓦市，是墨西哥经济学家和政府官员，现任财政和公共信贷部部长。他于1985年至1991年在墨西哥国立自治大学（UNAM）获得经济学学士学位，随后在墨西哥学院（El Colegio de México）取得经济学硕士学位。阿马多尔的职业生涯横跨公共和私营部门：在私营部门，他曾在Vector证券经纪公司、Stone & McCarthy研究机构以及法国德克夏银行墨西哥分公司任职；在公共部门，他曾担任联邦区财政管理总局长、墨西哥城金融规划副秘书长等职务。2012年至2018年，他在米格尔·安赫尔·曼塞拉担任墨西哥城市长期间出任财政部长，主导了多项城市基础设施融资创新项目。2024年10月，他被辛鲍姆政府任命为财政部副部长，2025年3月8日接替辞职的罗赫里奥·拉米雷斯·德拉奥升任部长，并于3月12日获参议院批准。值得注意的是，2021年他曾因涉嫌在2017年地震重建资金管理中存在违规行为而被墨西哥城市政府短暂停职，但最终未受经济处罚。他的施政重点包括减少财政赤字、维护宏观经济稳定、推动税务数字化和加强国际合作。",
  "profile": {
    "source_url": "",
    "local_path": null
  },
  "collection_meta": {
    "collection_date": "2026-05-21",
    "phase": "phase4_person_profile",
    "data_sources": [
      "wikipedia",
      "wikidata",
      "news_search",
      "web_search"
    ],
    "completeness_score": 77,
    "notes": "阿马多尔个人生活极度低调，家庭成员信息无法确认故未写入。部分早期私营部门职位缺少精确起止日期。其腐败争议已纳入政治立场中。",
    "quotes": [
      {
        "title": "Edgar Amador Zamora - Wikipedia (English)",
        "url": "https://en.wikipedia.org/wiki/Edgar_Amador_Zamora"
      },
      {
        "title": "Edgar Amador Zamora - Wikipedia (Español)",
        "url": "https://es.wikipedia.org/wiki/Edgar_Amador_Zamora"
      },
      {
        "title": "Edgar Amador Zamora - AS/COA",
        "url": "https://www.as-coa.org/speakers/edgar-amador-zamora"
      },
      {
        "title": "Edgar Amador Zamora - Milken Institute",
        "url": "https://milkeninstitute.org/events/global-investors-symposium-mexico-city-2025/speakers/edgar-amador"
      },
      {
        "title": "Él es Edgar Amador Zamora, el nuevo secretario de Hacienda - Expansión",
        "url": "https://expansion.mx/economia/2025/03/07/quien-es-edgar-amador-zamora-secretario-de-hacienda"
      },
      {
        "title": "美墨关税风暴背景下 墨西哥财长换人 - 新华社/腾讯新闻",
        "url": "https://news.qq.com/rain/a/20250308A0638800"
      },
      {
        "title": "Edgar Amador, nuevo titular de Hacienda, fue inhabilitado en 2021 - LatinUS",
        "url": "https://latinus.us/mexico/2025/3/7/edgar-amador-nuevo-titular-de-hacienda-fue-inhabilitado-en-2021-por-el-gobierno-de-sheinbaum-en-la-cdmx-por-presunta-corrupcion-136838.html"
      },
      {
        "title": "Edgar Amador Zamora - 百度百科中文",
        "url": "https://baike.baidu.com/item/%E5%9F%83%E5%BE%B7%E5%8A%A0%C2%B7%E9%98%BF%E9%A9%AC%E5%A4%9A%E5%B0%94%C2%B7%E8%90%A8%E8%8E%AB%E6%8B%89/65470120"
      }
    ]
  }
}