{
  "person_id": "BF-PERSON-000103",
  "wikidata_qid": null,
  "name_zh": "拉班基·阿布-巴克尔·齐达",
  "name": "Rabankhi Abou-Bâkr Zida",
  "name_en": "Rabankhi Abou-Bakr Zida",
  "aliases": [
    "Rabankhi Zida",
    "Rabankhi Abou-Bakr Zida",
    "Abou-Bâkr Rabankhi Zida",
    "Rabankhi A. Zida"
  ],
  "nationality": "BF",
  "gender": "male",
  "birth_date": null,
  "birth_place": null,
  "work_experience": [
    {
      "start_date": "1999",
      "end_date": "2012",
      "organization": "《希德瓦亚报》(Sidwaya)",
      "org_id": "BF-MEDIA-003",
      "position": "记者（后历任版组主编、总编辑、社长）"
    },
    {
      "start_date": "2012",
      "end_date": "2018",
      "organization": "希德瓦亚报业集团 (Éditions Sidwaya)",
      "org_id": "BF-MEDIA-003",
      "position": "总经理"
    },
    {
      "start_date": "2018",
      "end_date": "2021-02",
      "organization": "布基纳法索政府 (Gouvernement du Burkina Faso)",
      "org_id": "BF-GOV-003",
      "position": "政府发言人部长技术顾问"
    },
    {
      "start_date": "2021-02-17",
      "end_date": "2022-04",
      "organization": "传播、文化、艺术与旅游部 (Ministère de la Communication, de la Culture, des Arts et du Tourisme)",
      "org_id": "BF-GOV-010",
      "position": "秘书长"
    },
    {
      "start_date": "2022-04-28",
      "end_date": "2023-07-05",
      "organization": "布基纳广播电视台 (Radiodiffusion-Télévision du Burkina)",
      "org_id": "BF-MEDIA-001",
      "position": "台长"
    }
  ],
  "person_relationships": [
    {
      "person_id": "BF-PERSON-000060",
      "person_name": "阿泰里达尔·加利普·索梅 (Atéridar Galip Somé)",
      "relationship_type": "other",
      "description": "2023年6月29日部长会议任命索梅为布基纳广播电视台（RTB）台长，同年7月5日举行交接仪式，索梅正式接替齐达出任该职。"
    },
    {
      "person_id": "BF-PERSON-000002",
      "person_name": "里姆塔尔巴·让·埃马纽埃尔·韦德拉奥戈 (Rimtalba Jean Emmanuel Ouédraogo)",
      "relationship_type": "superior",
      "description": "2022年4月至2023年7月齐达任RTB台长期间，韦德拉奥戈自2022年3月过渡政府起担任传播、文化、艺术与旅游部长，为RTB上级主管部门部长。"
    },
    {
      "person_id": "BF-PERSON-000073",
      "person_name": "乌塞尼·坦布拉 (Ousséni Tamboura)",
      "relationship_type": "superior",
      "description": "2021年2月17日齐达经部长会议任命出任传播部秘书长时，坦布拉任传播部长。"
    },
    {
      "person_id": "BF-PERSON-000108",
      "person_name": "帕斯卡尔·耶姆博伊尼·蒂奥姆比亚诺 (Pascal Yemboini Thiombiano)",
      "relationship_type": "other",
      "description": "2022年4月28日RTB交接仪式上，齐达接替蒂奥姆比亚诺出任台长，蒂奥姆比亚诺为其前任（任内约4年）。"
    }
  ],
  "social_accounts": [
    {
      "platform": "facebook",
      "account_name": "Rabankhi Zida",
      "url": "https://www.facebook.com/rabankhi.zida/",
      "source": "Facebook搜索结果中的个人主页"
    },
    {
      "platform": "linkedin",
      "account_name": "Rabankhi A. ZIDA",
      "url": "https://bf.linkedin.com/in/rabankhi-a-zida-80aa1271",
      "source": "LinkedIn公开档案（自述为Éditions Sidwaya记者）"
    }
  ],
  "major_achievements": [
    {
      "date": "2023",
      "achievement": "任RTB台长期间推动加奥电视台（télé Gaoua）恢复播出，推进民族语言电视频道项目，并为员工制作职业证件以加强安全保障。",
      "organization": "布基纳广播电视台 (Radiodiffusion-Télévision du Burkina)"
    }
  ],
  "biography_summary": "拉班基·阿布-巴克·齐达（Rabankhi Abou-Bâkr Zida）为布基纳法索资深新闻工作者与公共媒体管理者。他自1999年起进入国营日报《希德瓦亚报》从事新闻工作，历任版组主编、总编辑、社长，2012年出任希德瓦亚报业集团总经理，执掌该国家报业集团六年（2012至2018年）。2018年起担任政府发言人部长技术顾问。2021年2月17日经部长会议任命出任传播部秘书长，接替奥尔唐斯·齐达（Hortense Zida）。2022年4月20日经部长会议任命为布基纳广播电视台（RTB）台长，4月28日正式就职，接替帕斯卡尔·延博伊尼·蒂奥姆比亚诺；任内推动恢复加奥电视台播出、推进民族语言电视项目并强化员工职业证件制度。2023年6月29日部长会议任命阿泰里达尔·加利普·索梅接任，同年7月5日完成交接。据burkina24报道，他持有信息传播技术专业高等专业学习文凭（DESS）并从事新闻教学培训工作。公开检索未发现其出任过渡政府传播部长的记录，其对应时期职务为传播部秘书长。",
  "collection_meta": {
    "collection_date": "2026-09-18",
    "phase": "phase4_person_profile",
    "data_sources": [
      "news_search",
      "web_search",
      "social_media"
    ],
    "notes": "关键职务均经至少两个独立来源交叉验证：RTB台长任命与就职（AIB、lefaso.net）、Sidwaya报业集团总经理2012-2018（burkina24、lefaso.net）、传播部秘书长2021-02-17任命（burkina24、lefaso.net）、2023-07-05卸任交接（wakatsera引官方DCRP/MCCAT通稿）。任务线索中「过渡政府传播部长」未获任何来源证实：检索到的完整履历显示其2021年2月至2022年4月任传播部秘书长（覆盖达米巴过渡初期），随后转任RTB台长，无部长任命记录，故未写入部长经历。BF-PERSON-000009（吉尔贝·韦德拉奥戈）与本人物无已证实关联，未建立该关系；RTB任期内上级主管部门部长为让·埃马纽埃尔·韦德拉奥戈（BF-PERSON-000002，2022年3月过渡政府任命）。学历信息（DESS文凭）仅burkina24单一来源提及且院校不明，未单列education条目。出生日期与出生地未检索到。无2023年7月卸任后任职的公开记录，故current_positions留空。法语维基百科无其独立条目（仅Yacouba Isaac Zida同名不同人）。 | 【字段优化2026-09-19】current_positions 为显示字段，已按 work_experience 补显；完整履历见该字段。",
    "quotes": [
      {
        "title": "Direction générale de la RTB: Galip Somé succède à Rabankhi Abou-Bâkr Zida - Wakat Séra",
        "url": "https://www.wakatsera.com/direction-generale-de-la-rtb-galip-some-succede-a-rabankhi-abou-bakr-zida/"
      },
      {
        "title": "Burkina : Le nouveau directeur général de la RTB Rabankhi Abou-Bâkr Zida installé - Agence d'Information du Burkina (AIB)",
        "url": "https://www.aib.media/burkina-le-nouveau-directeur-general-de-la-rtb-rabankhi-abou-bakr-zida-installe/"
      },
      {
        "title": "Radiodiffusion télévision du Burkina (RTB) : Qui est le nouveau directeur général, Rabankhi Abou-Bakr Zida - LeFaso.net",
        "url": "https://lefaso.net/spip.php?article112751"
      },
      {
        "title": "Ministère de la communication : Rabankhi Abou-Bâkr Zida nommé secrétaire général - Burkina24",
        "url": "https://burkina24.com/2021/02/17/ministere-de-la-communication-rabankhi-abou-bakr-zida-nomme-secretaire-general/"
      },
      {
        "title": "Pascal Thiombiano de nouveau à la tête de la télévision nationale - Aouaga",
        "url": "http://news.aouaga.com/h/114322.html"
      }
    ],
    "completeness_score": 56
  },
  "current_positions": [
    "前布基纳广播电视台台长（2022-2023）",
    "前希德瓦亚报业集团总经理（2012-2018）"
  ]
}