{
  "person_id": "JP-PERSON-000181",
  "wikidata_qid": null,
  "name_zh": "佐佐木雅之",
  "name": "佐々木雅之",
  "name_en": "Masayuki Sasaki",
  "aliases": [
    "ささき まさゆき",
    "Sasaki Masayuki"
  ],
  "nationality": "JP",
  "gender": "male",
  "birth_date": null,
  "birth_place": "日本山形县",
  "contacts": [],
  "current_positions": [
    "人事院事务总长"
  ],
  "education": [
    {
      "institution": "东京大学（東京大学）",
      "degree": "bachelor",
      "field": "法学",
      "start_date": null,
      "end_date": "1991"
    }
  ],
  "work_experience": [
    {
      "start_date": "1991",
      "end_date": "2001",
      "organization": "总务厅（総務庁）",
      "org_id": "JP-GOV-659",
      "position": "入职（行政管理局配属）"
    },
    {
      "start_date": "2001",
      "end_date": null,
      "organization": "总务省（総務省）",
      "org_id": "JP-GOV-003",
      "position": "行政评价局、自治行政局等部门历任"
    },
    {
      "start_date": null,
      "end_date": null,
      "organization": "内阁府（内閣府）",
      "org_id": "JP-GOV-002",
      "position": "出向（政策统括官付、大臣官房等）"
    },
    {
      "start_date": "2019",
      "end_date": "2021",
      "organization": "总务省自治行政局（総務省自治行政局）",
      "org_id": "JP-GOV-003",
      "position": "公务员部长（公務員部長）"
    },
    {
      "start_date": "2021",
      "end_date": "2023",
      "organization": "总务省自治行政局（総務省自治行政局）",
      "org_id": "JP-GOV-003",
      "position": "自治行政局长"
    },
    {
      "start_date": null,
      "end_date": null,
      "organization": "人事院给与局（人事院給与局）",
      "org_id": "JP-GOV-021",
      "position": "给与局次长"
    },
    {
      "start_date": "2024",
      "end_date": null,
      "organization": "人事院（人事院）",
      "org_id": "JP-GOV-021",
      "position": "事务总长"
    }
  ],
  "person_relationships": [
    {
      "person_id": "JP-PERSON-000178",
      "person_name": "川本裕子（川本裕子）",
      "relationship_type": "superior",
      "description": "人事院总裁川本裕子为佐佐木雅之的直接上级。事务总长辅佐总裁执行职务，在总裁一般监督下指挥监督人事院所有事务及技术活动。"
    },
    {
      "person_id": "JP-PERSON-000179",
      "person_name": "土生栄二（土生栄二）",
      "relationship_type": "colleague",
      "description": "人事院人事官，与佐佐木事务总长共同构成人事院核心管理团队"
    },
    {
      "person_id": "JP-PERSON-000180",
      "person_name": "菒原晶子（菒原晶子）",
      "relationship_type": "colleague",
      "description": "人事院人事官，与佐佐木事务总长共同构成人事院核心管理团队"
    }
  ],
  "social_accounts": [],
  "family_members": [],
  "political_stances": [],
  "major_achievements": [
    {
      "date": "2024",
      "achievement": "就任人事院事务总长，成为人事院事务总局最高负责人，辅佐总裁执行职务，指挥监督人事院所有事务及技术活动",
      "organization": "人事院（人事院）"
    },
    {
      "date": "2026-01",
      "achievement": "在人事院月报通卷第917号（令和8年1月1日发行）发表卷头言「選ばれる公務へ、政策を共創」，阐述人事院推动公务员制度改革的理念",
      "organization": "人事院（人事院）"
    }
  ],
  "biography_summary": "佐佐木雅之（佐々木雅之），日本人事院现任事务总长，为日本国家公务员制度核心事务官僚。出生于山形县，毕业于东京大学法学部（1991年），毕业后进入总务厅（后因中央省厅再编于2001年并入总务省）。职业生涯长期专注于行政组织与公务员制度管理，在总务省历任行政评价局、自治行政局等部门要职，并曾出向至内阁府担任政策统括官付、大臣官房等职务。2019年起任总务省自治行政局公务员部长，2021年升任自治行政局长，主管地方公务员制度、行政组织、选举制度等核心事务。从总务省自治行政局长退任后转入人事院，先后担任给与局次长，后升任事务总长。作为事务总长，辅佐总裁川本裕子执行职务，在总裁一般监督下指挥监督人事院所有事务及技术活动，统筹事务总局5课4局及公务员研修所、8地方事务局等组织运营。2026年1月在人事院月报发表卷头言，提出「迈向被选择的公务员制度，共创政策」的改革理念，推动人才管理改革、工作时间改革、采用过程改革等，致力于建设「被选择」的公务组织。",
  "profile": {
    "source_url": null,
    "local_path": null
  },
  "collection_meta": {
    "collection_date": "2026-06-16",
    "phase": "phase4_person_profile",
    "data_sources": [
      "wikipedia",
      "official_website",
      "news_search",
      "web_search",
      "government_directory"
    ],
    "completeness_score": 56,
    "notes": "身份已通过多个独立来源确认：日语Wikipedia人事院页面（2025年4月1日现在事务总局干部表列佐佐木雅之为事务总长）、人事院月报通卷第917号（令和8年1月1日发行，佐佐木事务总长发表卷头言「選ばれる公務へ、政策を共創」）、人事院官网相关页面。中文Wikipedia人事院页面（较旧版本）显示佐佐木曾担任给与局次长，符合内部晋升惯例。WebSearch辅助结果确认其出生于山形县、东京大学法学部毕业（1991年）、总务厅（后总务省）入职经历、曾任总务省自治行政局公务员部长（2019年）和自治行政局长（2021年），但搜索API多次返回限流错误，部分细节未能通过第二个独立来源完整交叉验证。事务总长就任具体日期（2024年内）和确切出生日期未能通过公开来源确认，故birth_date字段留空。未发现个人社交媒体账号。family_members字段因无公开家庭成员信息而留空。political_stances字段因人事院作为中立行政机关、佐佐木作为事务官僚未公开个人政治立场而留空。Wikidata无对应QID。",
    "quotes": [
      {
        "title": "人事院 日语Wikipedia（2025年4月1日现在事务总局干部表）",
        "url": "https://ja.wikipedia.org/wiki/%E4%BA%BA%E4%BA%8B%E9%99%A2"
      },
      {
        "title": "National Personnel Authority English Wikipedia",
        "url": "https://en.wikipedia.org/wiki/National_Personnel_Authority"
      },
      {
        "title": "人事院 中文Wikipedia（旧版干部表，显示佐佐木任给与局次长）",
        "url": "https://zh.wikipedia.org/wiki/%E4%BA%BA%E4%BA%8B%E9%99%A2"
      },
      {
        "title": "人事院月报令和7年度バックナンバー（通卷第917号卷头言作者确认）",
        "url": "https://www.jinji.go.jp/kouho_houdo/geppou/R7.html"
      },
      {
        "title": "人事院官网首页",
        "url": "https://www.jinji.go.jp/"
      },
      {
        "title": "人事院组织绍介页面",
        "url": "https://www.jinji.go.jp/syoukai/index.html"
      },
      {
        "title": "令和7年人事院建议（川本总裁记者会见，佐佐木事务总长为总裁辅佐）",
        "url": "https://www.jinji.go.jp/seisaku/kankoku/archive/r7/r7_top.html"
      }
    ]
  }
}