{
  "person_id": "BN-PERSON-000176",
  "wikidata_qid": "Q124250685",
  "name": "Anisha Rosnah binti Adam",
  "name_zh": "阿尼莎·罗丝娜",
  "name_en": "Anisha Rosnah binti Adam",
  "aliases": [
    "Anisha Isa-Kalebic",
    "Anisha Rosnah Isa-Kalebic",
    "Yang Amat Mulia Pengiran Anak Isteri Anisha Rosnah binti Adam",
    "Yang Mulia Dayang Anisha Rosnah binti Adam",
    "阿尼莎·罗斯娜",
    "Princess Anisha"
  ],
  "nationality": "BN",
  "gender": "female",
  "birth_date": "1994-11-06",
  "birth_place": null,
  "contacts": [],
  "current_positions": [
    "文莱王妃 (Pengiran Anak Isteri)"
  ],
  "education": [
    {
      "institution": "哲鲁东国际学校 (Sekolah Antarabangsa Jerudong)",
      "degree": "high_school",
      "field": null,
      "start_date": null,
      "end_date": null
    },
    {
      "institution": "巴斯大学 (University of Bath)",
      "degree": "bachelor",
      "field": "现代语言与欧洲研究",
      "start_date": null,
      "end_date": "2017"
    },
    {
      "institution": "马德里康普顿斯大学 (Universidad Complutense de Madrid)",
      "degree": "other",
      "field": null,
      "start_date": null,
      "end_date": null
    }
  ],
  "work_experience": [
    {
      "organization": "文莱王室 (Kerabat Diraja Brunei)",
      "org_id": "BN-GOV-001",
      "position": "王妃 (Pengiran Anak Isteri)",
      "start_date": "2024-01-11",
      "end_date": null
    },
    {
      "organization": "丝绸集体时装品牌 (Silk Collective)",
      "org_id": null,
      "position": "联合创始人",
      "start_date": "2019",
      "end_date": null
    },
    {
      "organization": "定制旅行企划平台 (Authentinerary)",
      "org_id": null,
      "position": "联合创始人",
      "start_date": "2016",
      "end_date": null
    }
  ],
  "person_relationships": [
    {
      "person_id": "BN-PERSON-000004",
      "person_name": "阿卜杜勒·马丁 (Pengiran Muda 'Abdul Mateen)",
      "relationship_type": "spouse",
      "description": "丈夫，苏丹哈桑纳尔·博尔基亚与第二位夫人米丽亚姆所幼子。两人自幼相识，据报道2018年开始交往；2023年10月8日首相署宣布订婚，2024年1月7日至16日举行十天王室婚礼，1月11日在斯里巴加湾市奥玛阿里赛义夫汀清真寺完成伊斯兰结合礼（akad nikah）"
    },
    {
      "person_id": "BN-PERSON-000001",
      "person_name": "苏丹哈桑纳尔·博尔基亚 (Sultan Hassanal Bolkiah)",
      "relationship_type": "in_law",
      "description": "公公（丈夫之父），文莱第29任苏丹兼首相"
    },
    {
      "person_id": "BN-PERSON-000002",
      "person_name": "穆赫塔迪·比拉王储 (Al-Muhtadee Billah)",
      "relationship_type": "in_law",
      "description": "丈夫的异母兄长，文莱王储兼首相署高级部长；其妻为彭基兰·安纳克·萨拉（Pengiran Anak Sarah），勿与本人物混淆"
    },
    {
      "person_id": "BN-PERSON-000255",
      "person_name": "伊萨·宾·易卜拉欣 (Pehin Dato Isa bin Ibrahim)",
      "relationship_type": "grandparent",
      "description": "外祖父，曾任文莱首相（首席部长）、内政部长和立法会议长，后任苏丹特别顾问"
    },
    {
      "person_id": "BN-PERSON-000256",
      "person_name": "西蒂·玛丽亚姆·宾蒂·伊萨 (Siti Mariam binti Isa)",
      "relationship_type": "parent",
      "description": "母亲，出身文莱马来政界名门；2009年与丈夫离婚"
    },
    {
      "person_id": "BN-PERSON-000257",
      "person_name": "亚当·宾·阿卜杜拉 (Adam bin Abdullah)",
      "relationship_type": "parent",
      "description": "父亲，克罗地亚裔，原名伊维察·亚当·卡莱比奇 (Ivica Adam Kalebic)；2009年与母亲离婚"
    }
  ],
  "social_accounts": [],
  "family_members": [
    {
      "person_id": "BN-PERSON-000004",
      "name": "阿卜杜勒·马丁 (Pengiran Muda 'Abdul Mateen)",
      "relationship": "spouse",
      "industry_or_organization": "文莱王子、外交部长"
    },
    {
      "person_id": null,
      "name": "亚当·宾·阿卜杜拉 (Adam bin Abdullah)",
      "relationship": "father",
      "industry_or_organization": "克罗地亚裔（原名 Ivica Adam Kalebic）"
    },
    {
      "person_id": null,
      "name": "西蒂·玛丽亚姆·宾蒂·伊萨 (Siti Mariam binti Isa)",
      "relationship": "mother",
      "industry_or_organization": "出身文莱马来政界名门"
    },
    {
      "person_id": null,
      "name": "伊萨·宾·易卜拉欣 (Pehin Dato Isa bin Ibrahim)",
      "relationship": "grandfather",
      "industry_or_organization": "文莱前首相（首席部长）、内政部长、立法会议长，苏丹特别顾问"
    },
    {
      "person_id": "BN-PERSON-000001",
      "name": "苏丹哈桑纳尔·博尔基亚 (Sultan Hassanal Bolkiah)",
      "relationship": "father_in_law",
      "industry_or_organization": "文莱苏丹兼首相"
    },
    {
      "person_id": null,
      "name": "扎赫拉·玛丽亚姆·博尔基亚 (Zahra Mariam Bolkiah)",
      "relationship": "daughter",
      "industry_or_organization": "文莱公主（2026年2月8日出生）"
    },
    {
      "person_id": null,
      "name": "丹尼尔·丁·伊萨-卡莱比奇 (Danial Deen Isa-Kalebic)",
      "relationship": "brother",
      "industry_or_organization": "胞弟，与阿卜杜勒·马丁王子为好友"
    },
    {
      "person_id": null,
      "name": "玛丽娜·伊萨-卡莱比奇 (Marina Isa-Kalebic)",
      "relationship": "sister",
      "industry_or_organization": "胞妹"
    },
    {
      "person_id": null,
      "name": "伊德里斯·伊萨-卡莱比奇 (Idris Isa-Kalebic)",
      "relationship": "brother",
      "industry_or_organization": "胞弟"
    }
  ],
  "political_stances": [],
  "major_achievements": [
    {
      "date": "2016",
      "achievement": "在巴斯大学就读期间与同学Emily Paul共同创立定制旅行企划平台Authentinerary，为巴黎、马德里、巴斯等地提供定制文化旅行行程服务",
      "organization": "定制旅行企划平台 (Authentinerary)"
    },
    {
      "date": "2019",
      "achievement": "与未来的姻亲姐妹珍妮蒂拉·阿塔斯库尔猜 (Janetira Attaskulchai) 共同创办时装品牌Silk Collective",
      "organization": "丝绸集体时装品牌 (Silk Collective)"
    },
    {
      "date": "2024-01-11",
      "achievement": "与阿卜杜勒·马丁王子完婚，获封「Pengiran Anak Isteri」（王妃）封号及「Yang Amat Mulia」（殿下）尊称，正式成为文莱王室成员；婚礼为期十天，多国元首与王室出席",
      "organization": "文莱王室 (Kerabat Diraja Brunei)"
    }
  ],
  "biography_summary": "阿尼莎·罗丝娜·宾蒂·亚当 (Anisha Rosnah binti Adam)，1994年11月6日出生（马来文维基作11月14日），文莱王妃，文莱苏丹哈桑纳尔·博尔基亚第四子阿卜杜勒·马丁王子的妻子。她出身文莱政界名门：外祖父佩欣·达托·伊萨 (Pehin Dato Isa bin Ibrahim) 曾任文莱首相（首席部长）、内政部长和立法会议长，后任苏丹特别顾问；曾外祖父易卜拉欣·宾·穆罕默德·贾法尔为文莱首任首相（首席部长）；父亲亚当·宾·阿卜杜拉（原名伊维察·亚当·卡莱比奇）为克罗地亚裔，母亲西蒂·玛丽亚姆·宾蒂·伊萨出自马来政界世家，父母于2009年离婚。她与三名胞弟妹均在文莱哲鲁东国际学校完成中小学教育，后赴英国巴斯大学深造，2017年获现代语言与欧洲研究文学士学位，期间曾赴马德里康普顿斯大学交换并在巴黎实习，通晓英语、法语、马来语和西班牙语。2016年仍在读大学时与同学联合创立定制旅行企划平台Authentinerary，2019年又与未来的姻亲姐妹共同创办时装品牌Silk Collective。她与马丁王子自幼相识，2023年10月8日文莱首相署宣布两人订婚；2024年1月7日至16日举行十天隆重王室婚礼，1月11日在斯里巴加湾市奥玛阿里赛义夫汀清真寺完成伊斯兰结合礼，1月14日举行并坐礼及都城巡游，婚后获「Pengiran Anak Isteri」（王妃）封号与「Yang Amat Mulia」（殿下）尊称。成为王室成员后，她随王室出席国事访问接待、授勋仪式和国庆庆典等公务，2024年7月赴吉隆坡出席柔佛州苏丹依布拉欣就任马来西亚第17任国家元首的登基典礼，并参与文莱首所特殊教育学校开幕、「信仰与虔诚」艺术展等公益文化活动。2026年2月8日产下长女扎赫拉·玛丽亚姆·博尔基亚公主 (Pengiran Anak Zahra Mariam Bolkiah)，努鲁尔伊曼宫为此鸣放17响礼炮。",
  "profile": {
    "source_url": "https://commons.wikimedia.org/wiki/Special:FilePath/Anisha%20Rosnah%20-%2053810915404.jpg",
    "local_path": null
  },
  "collection_meta": {
    "collection_date": "2026-09-30",
    "phase": "phase4_person_profile",
    "data_sources": [
      "wikipedia",
      "wikidata",
      "news_search",
      "web_search"
    ],
    "completeness_score": 72,
    "notes": "身份甄别：本人物为阿卜杜勒·马丁王子之妻（2024年1月成婚），而非王储穆赫塔迪·比拉之妻——王储妃为彭基兰·安纳克·萨拉 (Pengiran Anak Sarah)，两者已严格区分；person_id 经 _name_index.json 命中确认（BN-PERSON-000176，且BN-PERSON-000004画像中已互为配偶交叉引用）。关键事实双源验证：外祖父为苏丹特别顾问佩欣·达托·伊萨 (Pehin Dato Isa bin Ibrahim)（英文维基+文莱媒体The Scoop+婚礼专题条目）、婚礼日期与仪式流程（维基+The Scoop）、长女Zahra Mariam Bolkiah于2026年2月8日出生（英文维基+New My Royals/People报道）。存疑字段：出生日期英文与中文维基均作1994年11月6日，马来文维基作1994年11月14日，Wikidata无出生日期声明，按多数来源采用11月6日；出生地英文维基作伦敦、马来文维基作文莱，无法裁定故置null。社交媒体排查：Instagram现存相关账号（nishakalebic、anishaikthegreat、anisha_mateen等）均为粉丝页，未发现本人经验证的官方账号，social_accounts留空。",
    "quotes": [
      {
        "title": "Anisha Rosnah - Wikipedia",
        "url": "https://en.wikipedia.org/wiki/Anisha_Rosnah"
      },
      {
        "title": "Anisha Rosnah - Wikipedia (Bahasa Melayu)",
        "url": "https://ms.wikipedia.org/wiki/Anisha_Rosnah"
      },
      {
        "title": "Wedding of Prince Abdul Mateen and Anisha Rosnah - Wikipedia",
        "url": "https://en.wikipedia.org/wiki/Wedding_of_Prince_Abdul_Mateen_and_Anisha_Rosnah"
      },
      {
        "title": "Brunei's Prince Mateen to wed this January - The Scoop",
        "url": "https://thescoop.co/2023/10/08/bruneis-prince-mateen-set-to-wed-this-january/"
      },
      {
        "title": "Prince Abdul Mateen and Princess Anisha Share a Photo of Their Newborn Daughter - New My Royals",
        "url": "https://www.newmyroyals.com/2026/02/prince-abdul-mateen-and-princess-anisha-of-brunei.html"
      },
      {
        "title": "Wikidata Q124250685 - Princess Anisha Rosnah",
        "url": "https://www.wikidata.org/wiki/Q124250685"
      },
      {
        "title": "阿尼莎·羅斯娜 - 维基百科",
        "url": "https://zh.wikipedia.org/wiki/%E9%98%BF%E5%B0%BC%E8%8E%8E%C2%B7%E7%BE%85%E6%96%AF%E5%A8%9C"
      }
    ]
  }
}